[{"name":"2010 Rust Rewrite Mashup","guest":["Skate 3","Minecraft"],"host":"Call of Duty: Modern Warfare 2 via IW4L","creator":"chasmlol","status":["released","source-available"],"first_seen":"2026-09-28","source":"https://github.com/chasmlol/2010-rust-rewrite-mashup","release":"https://github.com/chasmlol/2010-rust-rewrite-mashup/releases","license":"Apache-2.0","category":"core","notes":"From-scratch Rust MW2 runtime with Skate 3 mode and a generated Minecraft world with blocks, mobs, inventory, mining and placement. v0.4.0 improved Minecraft-world frame pacing, made block edges grindable while skating, and fixed several gameplay/stability issues.","latest_release":"v0.4.0 (2026-10-02)","last_activity":"2026-10-02","id":"rust-rewrite-mashup","summary":"Combines Modern Warfare 2 multiplayer, Skate-style skating and a Minecraft world.","description":"A from-scratch Rust rewrite of MW2 that combines MW2 multiplayer, Skate 3-style skating and a real generated Minecraft world. The Minecraft mode includes blocks, mobs, inventory, mining/placing and world generation; Skate mode uses data from a user-owned Xbox 360 copy. **v0.4.0 (2 Oct 2026)** improved Minecraft-world frame pacing, made block edges grindable while skating, and fixed several gameplay/stability issues.","approach":"from-scratch Rust MW2 runtime + Skate 3 mode + Minecraft world/runtime integration","added_at":"2026-10-01","reviewed_at":null,"review_basis":"legacy-record","platforms":[],"requirements":null,"playtest":null,"creator_url":"https://github.com/chasmlol","extra_links":[{"label":"IW4L upstream","url":"https://github.com/vladtrc/iw4L"}],"review_note":"Imported from the existing catalogue; a dated source review and local play-test are not asserted."},{"name":"SkyCraft","guest":["Minecraft: Java Edition"],"host":"The Elder Scrolls V: Skyrim Special Edition","creator":"chasmlol","status":["released","source-available","experimental"],"first_seen":"2026-09-30","source":"https://github.com/chasmlol/SkyCraft","release":"https://github.com/chasmlol/SkyCraft/releases","license":"MIT","category":"core","notes":"SKSE plugin and Fabric mod communicate through shared memory; Minecraft runs game logic while Skyrim renders the world.","latest_release":"v0.1.2 (2026-10-01)","last_activity":"2026-10-01","id":"skycraft","summary":"Brings Minecraft building, exploration and gameplay into Skyrim.","description":"Minecraft remains running as the game-logic side while Skyrim renders the world. Movement, inventory, HUD, blocks, digging, fluids, lighting, combat and parts of Minecraft progression are integrated into Skyrim's world.","approach":"Skyrim SKSE plugin + Minecraft Fabric mod communicating via shared memory","added_at":"2026-10-01","reviewed_at":null,"review_basis":"legacy-record","platforms":[],"requirements":null,"playtest":null,"creator_url":"https://github.com/chasmlol","extra_links":[],"review_note":"Imported from the existing catalogue; a dated source review and local play-test are not asserted."},{"name":"Minecraft Crossover Bridge","guest":["Minecraft: Java Edition 1.21.1"],"host":"Monster Hunter: World / Elden Ring via CrossOver on Apple Silicon macOS","creator":"justbustin","status":["source-available","verified-wip"],"first_seen":"2026-10-01","source":"https://github.com/justbustin/minecraft-crossover-bridge","license":"MIT","category":"core","notes":"Bridges native macOS Minecraft into Windows games running under CrossOver via shared memory. Minecraft blocks, mobs and the player hand are composited into the host frame with depth/lighting; host terrain becomes Minecraft collision and damage is bridged both ways.","id":"minecraft-crossover-bridge","summary":"Brings Minecraft blocks, mobs and combat into Monster Hunter: World or Elden Ring on Apple Silicon Macs.","description":"Minecraft runs natively on macOS while the host game runs under CrossOver. The bridge composites Minecraft blocks, mobs and the player's hand into the host frame with depth/lighting, maps host collision into Minecraft, and bridges combat damage in both directions.","approach":"Fabric + native Windows bridge DLLs + shared memory + frame/depth compositing","added_at":"2026-10-02","reviewed_at":null,"review_basis":"legacy-record","platforms":[],"requirements":null,"playtest":null,"creator_url":"https://github.com/justbustin","extra_links":[],"review_note":"Imported from the existing catalogue; a dated source review and local play-test are not asserted."},{"name":"HytaleDoom","guest":["DOOM"],"host":"Hytale","creator":"tr7zw","status":["source-available","tech-demo"],"first_seen":"2026-01","source":"https://github.com/tr7zw/HytaleDoom","media":"https://www.youtube.com/watch?v=RxVj6_NKRDY","license":null,"category":"core","notes":"Java DOOM implementation rendered as raw pixel data inside a Hytale mod.","id":"hytale-doom","summary":"Lets you control DOOM from inside Hytale.","description":"A deliberately rough proof-of-concept built in a few nights. DOOM is rendered as raw pixel data inside Hytale and is controlled from the game.","approach":"Java Doom implementation rendered and controlled through a Hytale mod","added_at":"2026-10-01","reviewed_at":null,"review_basis":"legacy-record","platforms":[],"requirements":null,"playtest":null,"creator_url":"https://github.com/tr7zw","extra_links":[{"label":"vanilla-mocha-doom dependency","url":"https://github.com/gaborbata/vanilla-mocha-doom/"}],"review_note":"Imported from the existing catalogue; a dated source review and local play-test are not asserted."},{"name":"DoomMaps","guest":["DOOM"],"host":"Hytale","creator":"ssquadteam (Sadat Sahib / iamcxv7)","status":["source-available","tech-demo"],"first_seen":"2026-01-17","source":"https://github.com/ssquadteam/DoomMaps","license":"GPL-3.0","category":"core","notes":"Hytale plugin that renders DOOM frames to an in-game world-map display and maps player position/input into DOOM. Requires a user-supplied DOOM shareware WAD.","id":"doom-maps","summary":"Runs DOOM on Hytale’s in-game world-map screen.","description":"Runs DOOM through Hytale's in-game world-map display at a targeted 35 FPS, with movement/action controls mapped from Hytale input. It requires the user to supply the DOOM shareware WAD.","approach":"Hytale plugin + world-map framebuffer rendering","added_at":"2026-10-02","reviewed_at":null,"review_basis":"legacy-record","platforms":[],"requirements":null,"playtest":null,"creator_url":"https://github.com/ssquadteam","extra_links":[],"review_note":"Imported from the existing catalogue; a dated source review and local play-test are not asserted."},{"name":"HyCraft","guest":["Minecraft: Java Edition 1.21.11"],"host":"Hytale server","creator":"EdwardBelt","status":["released","source-available","experimental"],"first_seen":"2026-02-27","source":"https://github.com/EdwardBelt/HyCraft","release":"https://github.com/EdwardBelt/HyCraft/releases/tag/v1.1.4","license":"MIT","category":"core","notes":"Protocol bridge that lets unmodified Minecraft Java clients join Hytale servers, translating packets and synchronising chunks, entities, interactions/combat and inventory.","id":"hycraft","summary":"Lets Minecraft players join Hytale servers and interact with their worlds.","description":"Minecraft clients can connect to a Hytale server without a client mod. HyCraft converts chunks and biomes, synchronises entities and inventory, and translates block interaction and combat.","approach":"protocol bridge translating Minecraft packets into Hytale's server protocol","added_at":"2026-10-02","reviewed_at":"2026-10-05","review_basis":"primary-source-review","platforms":["Server-side Java"],"requirements":"A Hytale server and Java 25. Minecraft Java Edition 1.21.11 clients connect through the plugin's protocol bridge; optional deeper integration uses Hyxin mixins.","playtest":null,"creator_url":"https://github.com/EdwardBelt","extra_links":[],"review_note":"The HyCraft README, repository metadata and v1.1.4 release were reviewed on 2026-10-05. This source review does not record an independent live-server play-test.","latest_release":"v1.1.4 (2026-05-28)","last_activity":"2026-05-28"},{"name":"UltraDoom / UltrakillDoom","guest":["DOOM (1993)"],"host":"ULTRAKILL","creator":"Squaresweets","status":["released","source-available"],"first_seen":"2026-01-10","source":"https://github.com/Squaresweets/UltrakillDoom","license":null,"category":"core","notes":"BepInEx plugin that runs playable DOOM on ULTRAKILL shop terminals. Uses a user-supplied legitimate/shareware DOOM WAD and builds on DoomInUnityInspector/Managed Doom lineage.","id":"ultradoom","summary":"Lets you play DOOM on the shop terminals inside ULTRAKILL.","description":"Turns ULTRAKILL's diegetic shop terminals into playable DOOM instances. A legitimate or shareware DOOM WAD is supplied by the user.","approach":"BepInEx plugin built on DoomInUnityInspector / Managed Doom lineage","added_at":"2026-10-02","reviewed_at":null,"review_basis":"legacy-record","platforms":[],"requirements":null,"playtest":null,"creator_url":"https://github.com/Squaresweets","extra_links":[],"review_note":"Imported from the existing catalogue; a dated source review and local play-test are not asserted."},{"name":"HellGate: Doom Portal","guest":["DOOM II"],"host":"Minecraft: Java Edition 1.20.4","creator":"fate_worshipper","status":["released"],"first_seen":"2026-01-14","release":"https://www.curseforge.com/minecraft/mc-mods/hellgate-doom-portal","license":"All Rights Reserved","category":"core","notes":"Fabric mod that opens a playable DOOM II experience through an in-world portal/altar, with DOOM progress persisted between sessions.","id":"hellgate-doom-portal","summary":"Opens a portal from Minecraft into a playable DOOM II experience.","description":"An in-world portal and altar launch a playable DOOM II experience from Minecraft; DOOM saves and progress persist between sessions.","approach":"Fabric mod / OpenGL integration","added_at":"2026-10-02","reviewed_at":"2026-